{"environments":{"python":{"app_program":null,"closure":{"/nix/store/00000000000000000000000000000000-python":{"nar_hash":"sha256-AAAAAAAAAAAAAAAAAAAAAAAAAAAAAAAAAAAAAAAAAAA=","references":[]}},"definition":"mw1-environment-definition-0000000000000000000000000000000000000000000000000000000000000000","native_lock_sha256":null,"outputs":["/nix/store/00000000000000000000000000000000-python"],"source_sha256":"0000000000000000000000000000000000000000000000000000000000000000","sources":{"/nix/store/11111111111111111111111111111111-source":{"nar_hash":"sha256-AAAAAAAAAAAAAAAAAAAAAAAAAAAAAAAAAAAAAAAAAAA=","references":[]}},"system":"x86_64-linux"}},"schema_version":1,"source":{"files":{"flake.nix":{"executable":false,"sha256":"0000000000000000000000000000000000000000000000000000000000000000"}},"git":true},"workers":{"mw1-worker-definition-0000000000000000000000000000000000000000000000000000000000000000":{"environment":"python","executable_sha256":"0000000000000000000000000000000000000000000000000000000000000000","launch":{"args":[],"environment":"mw1-resolved-environment-0000000000000000000000000000000000000000000000000000000000000000","environment_variables":{"PATH":"/nix/store/00000000000000000000000000000000-python/bin"},"program":"sha256:0000000000000000000000000000000000000000000000000000000000000000","version":1,"working_directory":"private_run_directory"},"program":"/nix/store/00000000000000000000000000000000-python/bin/python3"}}}